PMID,Title,Authors,Citation,First Author,Journal/Book,Publication Year,Create Date,PMCID,NIHMS ID,DOI
"24315374","Stress-regulated translational attenuation adapts mitochondrial protein import through Tim17A degradation","Rainbolt TK, Atanassova N, Genereux JC, Wiseman RL.","Cell Metab. 2013 Dec 3;18(6):908-19. doi: 10.1016/j.cmet.2013.11.006.","Rainbolt TK","Cell Metab","2013","2013/12/10","PMC3904643","NIHMS541421","10.1016/j.cmet.2013.11.006"
"28430886","Intrinsic protein disorder reduces small-scale gene duplicability","Banerjee S, Feyertag F, Alvarez-Ponce D.","DNA Res. 2017 Aug 1;24(4):435-444. doi: 10.1093/dnares/dsx015.","Banerjee S","DNA Res","2017","2017/04/22","PMC5737077","","10.1093/dnares/dsx015"
"34799570","The autophagy protein ATG9A enables lipid mobilization from lipid droplets","Mailler E, Guardia CM, Bai X, Jarnik M, Williamson CD, Li Y, Maio N, Golden A, Bonifacino JS.","Nat Commun. 2021 Nov 19;12(1):6750. doi: 10.1038/s41467-021-26999-x.","Mailler E","Nat Commun","2021","2021/11/20","PMC8605025","","10.1038/s41467-021-26999-x"
"20727995","Model organisms--A historical perspective","Müller B, Grossniklaus U.","J Proteomics. 2010 Oct 10;73(11):2054-63. doi: 10.1016/j.jprot.2010.08.002. Epub 2010 Aug 19.","Müller B","J Proteomics","2010","2010/08/24","","","10.1016/j.jprot.2010.08.002"
"16452613","A general model of G protein-coupled receptor sequences and its application to detect remote homologs","Wistrand M, Käll L, Sonnhammer EL.","Protein Sci. 2006 Mar;15(3):509-21. doi: 10.1110/ps.051745906. Epub 2006 Feb 1.","Wistrand M","Protein Sci","2006","2006/02/03","PMC2249772","","10.1110/ps.051745906"
"12801408","Assembling a jigsaw puzzle with 20,000 parts","Marcotte EM.","Genome Biol. 2003;4(6):323. doi: 10.1186/gb-2003-4-6-323. Epub 2003 May 23.","Marcotte EM","Genome Biol","2003","2003/06/13","PMC193613","","10.1186/gb-2003-4-6-323"
"16158290","Data mining for protein-protein interactions in invertebrate model organisms","Buckingham SD.","Invert Neurosci. 2005 Nov;5(3-4):183-7. doi: 10.1007/s10158-005-0009-4. Epub 2005 Oct 24.","Buckingham SD","Invert Neurosci","2005","2005/09/15","","","10.1007/s10158-005-0009-4"
"18039386","Parameters of proteome evolution from histograms of amino-acid sequence identities of paralogous proteins","Axelsen JB, Yan KK, Maslov S.","Biol Direct. 2007 Nov 26;2:32. doi: 10.1186/1745-6150-2-32.","Axelsen JB","Biol Direct","2007","2007/11/28","PMC2246104","","10.1186/1745-6150-2-32"
"19154001","Quantitative regulation of alternative splicing in evolution and development","Irimia M, Rukov JL, Roy SW, Vinther J, Garcia-Fernandez J.","Bioessays. 2009 Jan;31(1):40-50. doi: 10.1002/bies.080092.","Irimia M","Bioessays","2009","2009/01/21","","","10.1002/bies.080092"
"12175474","Ageing research in Greece","Gonos ES, Agrafiotis D, Dontas AS, Efthimiopoulos S, Galaris D, Karamanos NK, Kletsas D, Kolettas E, Panayotou G, Pratsinis H, Sekeri-Pataryas KE, Simoes D, Sourlingas TG, Stathakos D, Stratigos AJ, Tavernarakis N, Trougakos IP, Tsiganos CP, Vynios DH.","Exp Gerontol. 2002 Jun;37(6):735-47. doi: 10.1016/s0531-5565(02)00017-7.","Gonos ES","Exp Gerontol","2002","2002/08/15","","","10.1016/s0531-5565(02)00017-7"
"22052992","Direct maximization of protein identifications from tandem mass spectra","Spivak M, Weston J, Tomazela D, MacCoss MJ, Noble WS.","Mol Cell Proteomics. 2012 Feb;11(2):M111.012161. doi: 10.1074/mcp.M111.012161. Epub 2011 Nov 3.","Spivak M","Mol Cell Proteomics","2012","2011/11/05","PMC3277760","","10.1074/mcp.M111.012161"
"24184799","Expression of A2V-mutated Aβ in Caenorhabditis elegans results in oligomer formation and toxicity","Diomede L, Di Fede G, Romeo M, Bagnati R, Ghidoni R, Fiordaliso F, Salio M, Rossi A, Catania M, Paterlini A, Benussi L, Bastone A, Stravalaci M, Gobbi M, Tagliavini F, Salmona M.","Neurobiol Dis. 2014 Feb;62:521-32. doi: 10.1016/j.nbd.2013.10.024. Epub 2013 Nov 1.","Diomede L","Neurobiol Dis","2014","2013/11/05","PMC4068289","","10.1016/j.nbd.2013.10.024"
"23825043","Lanthionine ketimine ethyl ester partially rescues neurodevelopmental defects in unc-33 (DPYSL2/CRMP2) mutants","Hubbard C, Benda E, Hardin T, Baxter T, St John E, O'Brien S, Hensley K, Holgado AM.","J Neurosci Res. 2013 Sep;91(9):1183-90. doi: 10.1002/jnr.23239. Epub 2013 Jul 3.","Hubbard C","J Neurosci Res","2013","2013/07/05","","","10.1002/jnr.23239"
"12379152","Birth and death of protein domains: a simple model of evolution explains power law behavior","Karev GP, Wolf YI, Rzhetsky AY, Berezovskaya FS, Koonin EV.","BMC Evol Biol. 2002 Oct 14;2:18. doi: 10.1186/1471-2148-2-18.","Karev GP","BMC Evol Biol","2002","2002/10/16","PMC137606","","10.1186/1471-2148-2-18"
"25159020","Genetic code expansion and bioorthogonal labelling enables cell specific proteomics in an animal","Elliott TS, Bianco A, Chin JW.","Curr Opin Chem Biol. 2014 Aug;21:154-60. doi: 10.1016/j.cbpa.2014.07.001. Epub 2014 Aug 20.","Elliott TS","Curr Opin Chem Biol","2014","2014/08/28","","","10.1016/j.cbpa.2014.07.001"
"27256381","Genome-Wide Approaches for RNA Structure Probing","Silverman IM, Berkowitz ND, Gosai SJ, Gregory BD.","Adv Exp Med Biol. 2016;907:29-59. doi: 10.1007/978-3-319-29073-7_2.","Silverman IM","Adv Exp Med Biol","2016","2016/06/04","","","10.1007/978-3-319-29073-7_2"
"23476066","Stiffened lipid platforms at molecular force foci","Anishkin A, Kung C.","Proc Natl Acad Sci U S A. 2013 Mar 26;110(13):4886-92. doi: 10.1073/pnas.1302018110. Epub 2013 Mar 8.","Anishkin A","Proc Natl Acad Sci U S A","2013","2013/03/12","PMC3612676","","10.1073/pnas.1302018110"
"25562820","Rb and FZR1/Cdh1 determine CDK4/6-cyclin D requirement in C. elegans and human cancer cells","The I, Ruijtenberg S, Bouchet BP, Cristobal A, Prinsen MB, van Mourik T, Koreth J, Xu H, Heck AJ, Akhmanova A, Cuppen E, Boxem M, Muñoz J, van den Heuvel S.","Nat Commun. 2015 Jan 6;6:5906. doi: 10.1038/ncomms6906.","The I","Nat Commun","2015","2015/01/07","PMC4354291","","10.1038/ncomms6906"
"15211504","Automatic target selection for structural genomics on eukaryotes","Liu J, Hegyi H, Acton TB, Montelione GT, Rost B.","Proteins. 2004 Aug 1;56(2):188-200. doi: 10.1002/prot.20012.","Liu J","Proteins","2004","2004/06/24","","","10.1002/prot.20012"
"15003845","Developmental regulation and secretion of nematode-specific cysteine-glycine domain proteins in Trichinella spiralis","Gare D, Boyd J, Connolly B.","Mol Biochem Parasitol. 2004 Apr;134(2):257-66. doi: 10.1016/j.molbiopara.2004.01.001.","Gare D","Mol Biochem Parasitol","2004","2004/03/09","","","10.1016/j.molbiopara.2004.01.001"
"30213940","SNX3-retromer requires an evolutionary conserved MON2:DOPEY2:ATP9A complex to mediate Wntless sorting and Wnt secretion","McGough IJ, de Groot REA, Jellett AP, Betist MC, Varandas KC, Danson CM, Heesom KJ, Korswagen HC, Cullen PJ.","Nat Commun. 2018 Sep 13;9(1):3737. doi: 10.1038/s41467-018-06114-3.","McGough IJ","Nat Commun","2018","2018/09/15","PMC6137200","","10.1038/s41467-018-06114-3"
"40127743","Systems biology of Haemonchus contortus - Advancing biotechnology for parasitic nematode control","Zheng Y, Young ND, Wang T, Chang BCH, Song J, Gasser RB.","Biotechnol Adv. 2025 Jul-Aug;81:108567. doi: 10.1016/j.biotechadv.2025.108567. Epub 2025 Mar 22.","Zheng Y","Biotechnol Adv","2025","2025/03/24","","","10.1016/j.biotechadv.2025.108567"
"26167768","An siRNA-based functional genomics screen for the identification of regulators of ciliogenesis and ciliopathy genes","Wheway G, Schmidts M, Mans DA, Szymanska K, Nguyen TT, Racher H, Phelps IG, Toedt G, Kennedy J, Wunderlich KA, Sorusch N, Abdelhamed ZA, Natarajan S, Herridge W, van Reeuwijk J, Horn N, Boldt K, Parry DA, Letteboer SJF, Roosing S, Adams M, Bell SM, Bond J, Higgins J, Morrison EE, Tomlinson DC, Slaats GG, van Dam TJP, Huang L, Kessler K, Giessl A, Logan CV, Boyle EA, Shendure J, Anazi S, Aldahmesh M, Al Hazzaa S, Hegele RA, Ober C, Frosk P, Mhanni AA, Chodirker BN, Chudley AE, Lamont R, Bernier FP, Beaulieu CL, Gordon P, Pon RT, Donahue C, Barkovich AJ, Wolf L, Toomes C, Thiel CT, Boycott KM, McKibbin M, Inglehearn CF; UK10K Consortium; University of Washington Center for Mendelian Genomics; Stewart F, Omran H, Huynen MA, Sergouniotis PI, Alkuraya FS, Parboosingh JS, Innes AM, Willoughby CE, Giles RH, Webster AR, Ueffing M, Blacque O, Gleeson JG, Wolfrum U, Beales PL, Gibson T, Doherty D, Mitchison HM, Roepman R, Johnson CA.","Nat Cell Biol. 2015 Aug;17(8):1074-1087. doi: 10.1038/ncb3201. Epub 2015 Jul 13.","Wheway G","Nat Cell Biol","2015","2015/07/14","PMC4536769","EMS63737","10.1038/ncb3201"
"29036198","The homeodomain-interacting protein kinase HPK-1 preserves protein homeostasis and longevity through master regulatory control of the HSF-1 chaperone network and TORC1-restricted autophagy in Caenorhabditis elegans","Das R, Melo JA, Thondamal M, Morton EA, Cornwell AB, Crick B, Kim JH, Swartz EW, Lamitina T, Douglas PM, Samuelson AV.","PLoS Genet. 2017 Oct 16;13(10):e1007038. doi: 10.1371/journal.pgen.1007038. eCollection 2017 Oct.","Das R","PLoS Genet","2017","2017/10/17","PMC5658188","","10.1371/journal.pgen.1007038"
"27876851","The genome, transcriptome, and proteome of the nematode Steinernema carpocapsae: evolutionary signatures of a pathogenic lifestyle","Rougon-Cardoso A, Flores-Ponce M, Ramos-Aboites HE, Martínez-Guerrero CE, Hao YJ, Cunha L, Rodríguez-Martínez JA, Ovando-Vázquez C, Bermúdez-Barrientos JR, Abreu-Goodger C, Chavarría-Hernández N, Simões N, Montiel R.","Sci Rep. 2016 Nov 23;6:37536. doi: 10.1038/srep37536.","Rougon-Cardoso A","Sci Rep","2016","2016/11/24","PMC5120318","","10.1038/srep37536"
"29510985","Molecular architecture of LSM14 interactions involved in the assembly of mRNA silencing complexes","Brandmann T, Fakim H, Padamsi Z, Youn JY, Gingras AC, Fabian MR, Jinek M.","EMBO J. 2018 Apr 3;37(7):e97869. doi: 10.15252/embj.201797869. Epub 2018 Mar 6.","Brandmann T","EMBO J","2018","2018/03/08","PMC5881628","","10.15252/embj.201797869"
"25190814","Physical and functional interactions between the histone H3K4 demethylase KDM5A and the nucleosome remodeling and deacetylase (NuRD) complex","Nishibuchi G, Shibata Y, Hayakawa T, Hayakawa N, Ohtani Y, Sinmyozu K, Tagami H, Nakayama J.","J Biol Chem. 2014 Oct 17;289(42):28956-70. doi: 10.1074/jbc.M114.573725. Epub 2014 Sep 4.","Nishibuchi G","J Biol Chem","2014","2014/09/06","PMC4200253","","10.1074/jbc.M114.573725"
"15642184","Operons in eukaryotes","Blumenthal T.","Brief Funct Genomic Proteomic. 2004 Nov;3(3):199-211. doi: 10.1093/bfgp/3.3.199.","Blumenthal T","Brief Funct Genomic Proteomic","2004","2005/01/12","","","10.1093/bfgp/3.3.199"
"22049343","Alternatively spliced domains interact to regulate BK potassium channel gating","Johnson BE, Glauser DA, Dan-Glauser ES, Halling DB, Aldrich RW, Goodman MB.","Proc Natl Acad Sci U S A. 2011 Dec 20;108(51):20784-9. doi: 10.1073/pnas.1116795108. Epub 2011 Nov 2.","Johnson BE","Proc Natl Acad Sci U S A","2011","2011/11/04","PMC3251094","","10.1073/pnas.1116795108"
"26833085","Joint mouse-human phenome-wide association to test gene function and disease risk","Wang X, Pandey AK, Mulligan MK, Williams EG, Mozhui K, Li Z, Jovaisaite V, Quarles LD, Xiao Z, Huang J, Capra JA, Chen Z, Taylor WL, Bastarache L, Niu X, Pollard KS, Ciobanu DC, Reznik AO, Tishkov AV, Zhulin IB, Peng J, Nelson SF, Denny JC, Auwerx J, Lu L, Williams RW.","Nat Commun. 2016 Feb 2;7:10464. doi: 10.1038/ncomms10464.","Wang X","Nat Commun","2016","2016/02/03","PMC4740880","","10.1038/ncomms10464"
"33930289","Splice site m(6)A methylation prevents binding of U2AF35 to inhibit RNA splicing","Mendel M, Delaney K, Pandey RR, Chen KM, Wenda JM, Vågbø CB, Steiner FA, Homolka D, Pillai RS.","Cell. 2021 Jun 10;184(12):3125-3142.e25. doi: 10.1016/j.cell.2021.03.062. Epub 2021 Apr 29.","Mendel M","Cell","2021","2021/04/30","PMC8208822","","10.1016/j.cell.2021.03.062"
"17460191","The role of the MORF/MRG family of genes in cell growth, differentiation, DNA repair, and thereby aging","Pena AN, Pereira-Smith OM.","Ann N Y Acad Sci. 2007 Apr;1100:299-305. doi: 10.1196/annals.1395.031.","Pena AN","Ann N Y Acad Sci","2007","2007/04/27","","","10.1196/annals.1395.031"
"28090394","GExplore 1.4: An expanded web interface for queries on Caenorhabditis elegans protein and gene function","Hutter H, Suh J.","Worm. 2016 Sep 19;5(4):e1234659. doi: 10.1080/21624054.2016.1234659. eCollection 2016.","Hutter H","Worm","2016","2017/01/17","PMC5190144","","10.1080/21624054.2016.1234659"
"16375674","Fungal pathogens research: novel and improved molecular approaches for the discovery of antifungal drug targets","Tournu H, Serneels J, Van Dijck P.","Curr Drug Targets. 2005 Dec;6(8):909-22. doi: 10.2174/138945005774912690.","Tournu H","Curr Drug Targets","2005","2005/12/27","","","10.2174/138945005774912690"
"12659736","Protein database of Caenorhabditis elegans","Kaji H, Isobe T.","J Chromatogr B Analyt Technol Biomed Life Sci. 2003 Apr 5;787(1):91-9. doi: 10.1016/s1570-0232(02)00338-0.","Kaji H","J Chromatogr B Analyt Technol Biomed Life Sci","2003","2003/03/28","","","10.1016/s1570-0232(02)00338-0"
"17962311","CEBS--Chemical Effects in Biological Systems: a public data repository integrating study design and toxicity data with microarray and proteomics data","Waters M, Stasiewicz S, Merrick BA, Tomer K, Bushel P, Paules R, Stegman N, Nehls G, Yost KJ, Johnson CH, Gustafson SF, Xirasagar S, Xiao N, Huang CC, Boyer P, Chan DD, Pan Q, Gong H, Taylor J, Choi D, Rashid A, Ahmed A, Howle R, Selkirk J, Tennant R, Fostel J.","Nucleic Acids Res. 2008 Jan;36(Database issue):D892-900. doi: 10.1093/nar/gkm755. Epub 2007 Oct 25.","Waters M","Nucleic Acids Res","2008","2007/10/27","PMC2238989","","10.1093/nar/gkm755"
"24762742","The periplasmic enzyme, AnsB, of Shigella flexneri modulates bacterial adherence to host epithelial cells","George DT, Mathesius U, Behm CA, Verma NK.","PLoS One. 2014 Apr 24;9(4):e94954. doi: 10.1371/journal.pone.0094954. eCollection 2014.","George DT","PLoS One","2014","2014/04/26","PMC3998974","","10.1371/journal.pone.0094954"
"35874276","HSF-1: Guardian of the Proteome Through Integration of Longevity Signals to the Proteostatic Network","Lazaro-Pena MI, Ward ZC, Yang S, Strohm A, Merrill AK, Soto CA, Samuelson AV.","Front Aging. 2022 Jul 8;3:861686. doi: 10.3389/fragi.2022.861686. eCollection 2022.","Lazaro-Pena MI","Front Aging","2022","2022/07/25","PMC9304931","","10.3389/fragi.2022.861686"
"25215496","Multilayered genetic and omics dissection of mitochondrial activity in a mouse reference population","Wu Y, Williams EG, Dubuis S, Mottis A, Jovaisaite V, Houten SM, Argmann CA, Faridi P, Wolski W, Kutalik Z, Zamboni N, Auwerx J, Aebersold R.","Cell. 2014 Sep 11;158(6):1415-1430. doi: 10.1016/j.cell.2014.07.039.","Wu Y","Cell","2014","2014/09/13","PMC4179868","NIHMS628079","10.1016/j.cell.2014.07.039"
"32380953","The tapeworm interactome: inferring confidence scored protein-protein interactions from the proteome of Hymenolepis microstoma","James K, Olson PD.","BMC Genomics. 2020 May 7;21(1):346. doi: 10.1186/s12864-020-6710-1.","James K","BMC Genomics","2020","2020/05/09","PMC7204028","","10.1186/s12864-020-6710-1"
"27762328","Nuclear receptor nhr-48 is required for pathogenicity of the second stage (J2) of the plant parasite Meloidogyne incognita","Lu CJ, Tian BY, Cao Y, Zou CG, Zhang KQ.","Sci Rep. 2016 Oct 20;6:34959. doi: 10.1038/srep34959.","Lu CJ","Sci Rep","2016","2016/10/21","PMC5071846","","10.1038/srep34959"
"20858264","A proteomic view of Caenorhabditis elegans caused by short-term hypoxic stress","Li H, Ren C, Shi J, Hang X, Zhang F, Gao Y, Wu Y, Xu L, Chen C, Zhang C.","Proteome Sci. 2010 Sep 21;8:49. doi: 10.1186/1477-5956-8-49.","Li H","Proteome Sci","2010","2010/09/23","PMC2954870","","10.1186/1477-5956-8-49"
"39345438","In-cell processing enables rapid and in-depth proteome analysis of low-input Caenorhabditis elegans","Elsayyid M, Tanis JE, Yu Y.","bioRxiv [Preprint]. 2024 Sep 19:2024.09.18.613705. doi: 10.1101/2024.09.18.613705.","Elsayyid M","bioRxiv","2024","2024/09/30","PMC11429863","","10.1101/2024.09.18.613705"
"26896576","Phenotypic and molecular analysis of the effect of 20-hydroxyecdysone on the human filarial parasite Brugia malayi","Mhashilkar AS, Adapa SR, Jiang RH, Williams SA, Zaky W, Slatko BE, Luck AN, Moorhead AR, Unnasch TR.","Int J Parasitol. 2016 May;46(5-6):333-41. doi: 10.1016/j.ijpara.2016.01.005. Epub 2016 Feb 16.","Mhashilkar AS","Int J Parasitol","2016","2016/02/21","PMC4936774","NIHMS763166","10.1016/j.ijpara.2016.01.005"
"12801409","Translating genome sequences into biological understanding","Iyer VR.","Genome Biol. 2003;4(6):324. doi: 10.1186/gb-2003-4-6-324. Epub 2003 May 23.","Iyer VR","Genome Biol","2003","2003/06/13","PMC193614","","10.1186/gb-2003-4-6-324"
"29218323","SAP97 Binding Partner CRIPT Promotes Dendrite Growth In Vitro and In Vivo","Zhang L, Jablonski AM, Mojsilovic-Petrovic J, Ding H, Seeholzer S, Newton IP, Nathke I, Neve R, Zhai J, Shang Y, Zhang M, Kalb RG.","eNeuro. 2017 Dec 6;4(6):ENEURO.0175-17.2017. doi: 10.1523/ENEURO.0175-17.2017. eCollection 2017 Nov-Dec.","Zhang L","eNeuro","2017","2017/12/09","PMC5718245","","10.1523/ENEURO.0175-17.2017"
"17580302","Ca(2+)/calmodulin directly interacts with the pleckstrin homology domain of AKT1","Dong B, Valencia CA, Liu R.","J Biol Chem. 2007 Aug 24;282(34):25131-40. doi: 10.1074/jbc.M702123200. Epub 2007 Jun 19.","Dong B","J Biol Chem","2007","2007/06/21","","","10.1074/jbc.M702123200"
"38152979","'Bingo'-a large language model- and graph neural network-based workflow for the prediction of essential genes from protein data","Ma J, Song J, Young ND, Chang BCH, Korhonen PK, Campos TL, Liu H, Gasser RB.","Brief Bioinform. 2023 Nov 22;25(1):bbad472. doi: 10.1093/bib/bbad472.","Ma J","Brief Bioinform","2023","2023/12/28","PMC10753293","","10.1093/bib/bbad472"
"22280095","Quality control compartments coming of age","Ben-Gedalya T, Cohen E.","Traffic. 2012 May;13(5):635-42. doi: 10.1111/j.1600-0854.2012.01330.x. Epub 2012 Feb 16.","Ben-Gedalya T","Traffic","2012","2012/01/28","","","10.1111/j.1600-0854.2012.01330.x"
"24744987","Active transcriptomic and proteomic reprogramming in the C. elegans nucleotide excision repair mutant xpa-1","Kassahun H, Nilsen H.","Worm. 2013 Oct 1;2(4):e27337. doi: 10.4161/worm.27337. Epub 2013 Dec 5.","Kassahun H","Worm","2013","2014/04/19","PMC3923784","","10.4161/worm.27337"
"19333396","A top-down approach to infer and compare domain-domain interactions across eight model organisms","Guda C, King BR, Pal LR, Guda P.","PLoS One. 2009;4(3):e5096. doi: 10.1371/journal.pone.0005096. Epub 2009 Mar 31.","Guda C","PLoS One","2009","2009/04/01","PMC2659750","","10.1371/journal.pone.0005096"
"15788102","Evolutionary cores of domain co-occurrence networks","Wuchty S, Almaas E.","BMC Evol Biol. 2005 Mar 23;5:24. doi: 10.1186/1471-2148-5-24.","Wuchty S","BMC Evol Biol","2005","2005/03/25","PMC1079808","","10.1186/1471-2148-5-24"
"35094084","Deregulation of microtubule organization and RNA metabolism in Arx models for lissencephaly and developmental epileptic encephalopathy","Drongitis D, Caterino M, Verrillo L, Santonicola P, Costanzo M, Poeta L, Attianese B, Barra A, Terrone G, Lioi MB, Paladino S, Di Schiavi E, Costa V, Ruoppolo M, Miano MG.","Hum Mol Genet. 2022 Jun 4;31(11):1884-1908. doi: 10.1093/hmg/ddac028.","Drongitis D","Hum Mol Genet","2022","2022/01/30","PMC9169459","","10.1093/hmg/ddac028"
"32795511","Toward integrative 'omics of the barber's pole worm and related parasitic nematodes","Ma G, Gasser RB, Wang T, Korhonen PK, Young ND.","Infect Genet Evol. 2020 Nov;85:104500. doi: 10.1016/j.meegid.2020.104500. Epub 2020 Aug 11.","Ma G","Infect Genet Evol","2020","2020/08/16","","","10.1016/j.meegid.2020.104500"
"11130711","Analysis of the genome sequence of the flowering plant Arabidopsis thaliana","Arabidopsis Genome Initiative.","Nature. 2000 Dec 14;408(6814):796-815. doi: 10.1038/35048692.","Arabidopsis Genome Initiative","Nature","2000","2000/12/29","","","10.1038/35048692"
"29211722","Enhancing mitochondrial proteostasis reduces amyloid-β proteotoxicity","Sorrentino V, Romani M, Mouchiroud L, Beck JS, Zhang H, D'Amico D, Moullan N, Potenza F, Schmid AW, Rietsch S, Counts SE, Auwerx J.","Nature. 2017 Dec 14;552(7684):187-193. doi: 10.1038/nature25143. Epub 2017 Dec 6.","Sorrentino V","Nature","2017","2017/12/07","PMC5730497","NIHMS921329","10.1038/nature25143"
"28243620","Dataset of proteomics analysis of aging C. elegans exposed to Pseudomonas aeruginosa strain PA01","King CD, Singh D, Holden K, Govan AB, Keith S, Ghazi A, Robinson RA.","Data Brief. 2017 Feb 9;11:245-251. doi: 10.1016/j.dib.2017.02.001. eCollection 2017 Apr.","King CD","Data Brief","2017","2017/03/01","PMC5320047","","10.1016/j.dib.2017.02.001"
"39233003","Dual-species proteomics and targeted intervention of animal-pathogen interactions","Liu YS, Zhang C, Khoo BL, Hao P, Chua SL.","J Adv Res. 2024 Sep 2:S2090-1232(24)00383-7. doi: 10.1016/j.jare.2024.08.038. Online ahead of print.","Liu YS","J Adv Res","2024","2024/09/05","","","10.1016/j.jare.2024.08.038"
"26435885","Proteomic identification of germline proteins in Caenorhabditis elegans","Turner BE, Basecke SM, Bazan GC, Dodge ES, Haire CM, Heussman DJ, Johnson CL, Mukai CK, Naccarati AM, Norton SJ, Sato JR, Talavera CO, Wade MV, Hillers KJ.","Worm. 2015 Feb 9;4(1):e1008903. doi: 10.1080/21624054.2015.1008903. eCollection 2015 Jan-Mar.","Turner BE","Worm","2015","2015/10/06","PMC4590026","","10.1080/21624054.2015.1008903"
"12886250","Proteomic analysis of the cell-surface membrane in chronic lymphocytic leukemia: identification of two novel proteins, BCNP1 and MIG2B","Boyd RS, Adam PJ, Patel S, Loader JA, Berry J, Redpath NT, Poyser HR, Fletcher GC, Burgess NA, Stamps AC, Hudson L, Smith P, Griffiths M, Willis TG, Karran EL, Oscier DG, Catovsky D, Terrett JA, Dyer MJ.","Leukemia. 2003 Aug;17(8):1605-12. doi: 10.1038/sj.leu.2402993.","Boyd RS","Leukemia","2003","2003/07/30","","","10.1038/sj.leu.2402993"
"12872006","Automated identification of putative methyltransferases from genomic open reading frames","Katz JE, Dlakić M, Clarke S.","Mol Cell Proteomics. 2003 Aug;2(8):525-40. doi: 10.1074/mcp.M300037-MCP200. Epub 2003 Jul 18.","Katz JE","Mol Cell Proteomics","2003","2003/07/23","","","10.1074/mcp.M300037-MCP200"
"22198733","Small-molecule proteostasis regulators for protein conformational diseases","Calamini B, Silva MC, Madoux F, Hutt DM, Khanna S, Chalfant MA, Saldanha SA, Hodder P, Tait BD, Garza D, Balch WE, Morimoto RI.","Nat Chem Biol. 2011 Dec 25;8(2):185-96. doi: 10.1038/nchembio.763.","Calamini B","Nat Chem Biol","2011","2011/12/27","PMC3262058","NIHMS331895","10.1038/nchembio.763"
"32984658","Protein interactome mapping in Caenorhabditis elegans","Remmelzwaal S, Boxem M.","Curr Opin Syst Biol. 2019 Feb;13:1-9. doi: 10.1016/j.coisb.2018.08.006.","Remmelzwaal S","Curr Opin Syst Biol","2019","2020/09/28","PMC7493430","","10.1016/j.coisb.2018.08.006"
"25114903","miRSeq: a user-friendly standalone toolkit for sequencing quality evaluation and miRNA profiling","Pan CT, Tsai KW, Hung TM, Lin WC, Pan CY, Yu HR, Li SC.","Biomed Res Int. 2014;2014:462135. doi: 10.1155/2014/462135. Epub 2014 Jun 24.","Pan CT","Biomed Res Int","2014","2014/08/13","PMC4119685","","10.1155/2014/462135"
"31440221","The Inducible Response of the Nematode Caenorhabditis elegans to Members of Its Natural Microbiota Across Development and Adult Life","Yang W, Petersen C, Pees B, Zimmermann J, Waschina S, Dirksen P, Rosenstiel P, Tholey A, Leippe M, Dierking K, Kaleta C, Schulenburg H.","Front Microbiol. 2019 Aug 7;10:1793. doi: 10.3389/fmicb.2019.01793. eCollection 2019.","Yang W","Front Microbiol","2019","2019/08/24","PMC6693516","","10.3389/fmicb.2019.01793"
"35645788","Autophagy Regulation Influences β-Amyloid Toxicity in Transgenic Caenorhabditis elegans","Lin H, Gao Y, Zhang C, Ma B, Wu M, Cui X, Wang H.","Front Aging Neurosci. 2022 May 12;14:885145. doi: 10.3389/fnagi.2022.885145. eCollection 2022.","Lin H","Front Aging Neurosci","2022","2022/06/01","PMC9133694","","10.3389/fnagi.2022.885145"
"21798523","Caenorhabditis elegans proteins captured by immobilized Galβ1-4Fuc disaccharide units: assignment of 3 annexins","Takeuchi T, Nishiyama K, Yamada A, Tamura M, Takahashi H, Natsugari H, Aikawa J, Kojima-Aikawa K, Arata Y, Kasai K.","Carbohydr Res. 2011 Sep 27;346(13):1837-41. doi: 10.1016/j.carres.2011.05.012. Epub 2011 May 19.","Takeuchi T","Carbohydr Res","2011","2011/07/30","","","10.1016/j.carres.2011.05.012"
"28953426","Proteomic Analysis of Differentially Expressed Proteins in Intracranial Angiostrongylus cantonensis Larvae in Permissive and Non-Permissive Hosts","She D, Zhang X, Mo Z, Yang G, Shin JW, Chen X, Cui L, Li H.","J Parasitol. 2017 Dec;103(6):718-726. doi: 10.1645/15-933. Epub 2017 Sep 27.","She D","J Parasitol","2017","2017/09/28","","","10.1645/15-933"
"15777020","Antioxidant and cytoprotective responses to redox stress","Mathers J, Fraser JA, McMahon M, Saunders RD, Hayes JD, McLellan LI.","Biochem Soc Symp. 2004;(71):157-76. doi: 10.1042/bss0710157.","Mathers J","Biochem Soc Symp","2004","2005/03/22","","","10.1042/bss0710157"
"12848943","Functional genomics in the study of autoimmune diseases","Alarcón-Riquelme ME.","Autoimmun Rev. 2003 Jun;2(4):177-80. doi: 10.1016/s1568-9972(03)00008-9.","Alarcón-Riquelme ME","Autoimmun Rev","2003","2003/07/10","","","10.1016/s1568-9972(03)00008-9"
"30397019","iProteinDB: An Integrative Database of Drosophila Post-translational Modifications","Hu Y, Sopko R, Chung V, Foos M, Studer RA, Landry SD, Liu D, Rabinow L, Gnad F, Beltrao P, Perrimon N.","G3 (Bethesda). 2019 Jan 9;9(1):1-11. doi: 10.1534/g3.118.200637.","Hu Y","G3 (Bethesda)","2019","2018/11/07","PMC6325894","","10.1534/g3.118.200637"
